{
  "schema_version": "1.0.0",
  "run_id": "RUN-SUPABASE-50569-BLIND-R3-20260921",
  "project_code": "OSS-BLIND-R3",
  "work_item_id": "SUPABASE-50569",
  "work_item_level": "M",
  "mode": "validate",
  "strict": true,
  "status": "completed",
  "stop_at": "strict_gate",
  "current_stage": null,
  "created_at": "2026-09-21T11:17:03+00:00",
  "updated_at": "2026-09-22T05:33:07+00:00",
  "run_dir": "assets/projects/OSS-BLIND-R3/work_items/SUPABASE-50569/.generation/runs/RUN-SUPABASE-50569-BLIND-R3-20260921",
  "stages": [
    {
      "stage_id": "requirement_intake",
      "order": 0,
      "kind": "validation",
      "status": "succeeded",
      "attempts": 1,
      "required_files": [
        "inputs/requirement_summary.md",
        "inputs/source_manifest.json"
      ],
      "input_fingerprint": "920896fb1179cf00fd4fd65ba40dac3aa550d3bb6a7a3581367903db1131cb90",
      "started_at": "2026-09-21T11:17:03+00:00",
      "completed_at": "2026-09-21T11:17:03+00:00",
      "last_exit_code": 0,
      "log_path": "assets/projects/OSS-BLIND-R3/work_items/SUPABASE-50569/.generation/runs/RUN-SUPABASE-50569-BLIND-R3-20260921/logs/requirement_intake.log"
    },
    {
      "stage_id": "evidence",
      "order": 1,
      "kind": "checkpoint",
      "status": "succeeded",
      "attempts": 1,
      "required_files": [
        "evidence/evidence_inventory.json"
      ],
      "input_fingerprint": "82a24cc4a44a57b0c60db131f0455c84d7f88b09f3169eca8e8879768ffd7562",
      "started_at": "2026-09-21T11:26:29+00:00",
      "completed_at": "2026-09-21T11:26:29+00:00",
      "last_exit_code": 0,
      "log_path": "assets/projects/OSS-BLIND-R3/work_items/SUPABASE-50569/.generation/runs/RUN-SUPABASE-50569-BLIND-R3-20260921/logs/evidence.log"
    },
    {
      "stage_id": "reasoning",
      "order": 2,
      "kind": "validation",
      "status": "succeeded",
      "attempts": 1,
      "required_files": [
        "analysis/reasoning_pack.json"
      ],
      "input_fingerprint": "36e053d142f12b982016e107daeb47b9b16db11e16bdc2269ae979da7c4bb392",
      "started_at": "2026-09-21T11:34:51+00:00",
      "completed_at": "2026-09-21T11:34:51+00:00",
      "last_exit_code": 0,
      "log_path": "assets/projects/OSS-BLIND-R3/work_items/SUPABASE-50569/.generation/runs/RUN-SUPABASE-50569-BLIND-R3-20260921/logs/reasoning.log"
    },
    {
      "stage_id": "structured_prd",
      "order": 3,
      "kind": "validation",
      "status": "succeeded",
      "attempts": 1,
      "required_files": [
        "structured_prd/structured_prd.json"
      ],
      "input_fingerprint": "22f4f294a577e5ac28912ada0ef7b5bc8b2419edd59c0e07561f9b17c6e9dd61",
      "started_at": "2026-09-21T11:45:26+00:00",
      "completed_at": "2026-09-21T11:45:26+00:00",
      "last_exit_code": 0,
      "log_path": "assets/projects/OSS-BLIND-R3/work_items/SUPABASE-50569/.generation/runs/RUN-SUPABASE-50569-BLIND-R3-20260921/logs/structured_prd.log"
    },
    {
      "stage_id": "coverage",
      "order": 4,
      "kind": "validation",
      "status": "succeeded",
      "attempts": 1,
      "required_files": [
        "coverage/coverage_matrix.json"
      ],
      "input_fingerprint": "c23f30108aaf79bc6ca75e9bd5a539df2f4894ee83931b29c9a76d0bd19a7887",
      "started_at": "2026-09-21T11:52:54+00:00",
      "completed_at": "2026-09-21T11:52:54+00:00",
      "last_exit_code": 0,
      "log_path": "assets/projects/OSS-BLIND-R3/work_items/SUPABASE-50569/.generation/runs/RUN-SUPABASE-50569-BLIND-R3-20260921/logs/coverage.log"
    },
    {
      "stage_id": "testability_gate",
      "order": 5,
      "kind": "validation",
      "status": "succeeded",
      "attempts": 1,
      "required_files": [
        "acceptance/testability_gate.json"
      ],
      "input_fingerprint": "1dd6e88b0c66b6e20f177920de744841c1f1e68e2eb048fb9f5b327d44a44a28",
      "started_at": "2026-09-21T12:17:29+00:00",
      "completed_at": "2026-09-21T12:17:29+00:00",
      "last_exit_code": 0,
      "log_path": "assets/projects/OSS-BLIND-R3/work_items/SUPABASE-50569/.generation/runs/RUN-SUPABASE-50569-BLIND-R3-20260921/logs/testability_gate.log"
    },
    {
      "stage_id": "acceptance_examples",
      "order": 6,
      "kind": "validation",
      "status": "succeeded",
      "attempts": 2,
      "required_files": [
        "acceptance/acceptance_examples.json"
      ],
      "input_fingerprint": "5f7db078d76fbc40dac77b1403b8917db9332386eef007ed09f8cc76260a5c31",
      "started_at": "2026-09-21T14:09:53+00:00",
      "completed_at": "2026-09-21T14:09:53+00:00",
      "last_exit_code": 0,
      "log_path": "assets/projects/OSS-BLIND-R3/work_items/SUPABASE-50569/.generation/runs/RUN-SUPABASE-50569-BLIND-R3-20260921/logs/acceptance_examples.log"
    },
    {
      "stage_id": "case_plan",
      "order": 7,
      "kind": "validation",
      "status": "succeeded",
      "attempts": 2,
      "required_files": [
        "testcases/case_plan.json"
      ],
      "input_fingerprint": "158061919f988bb69821dac255b8a1ef6bc2b2c6a5147767e428ce5b07516d34",
      "started_at": "2026-09-21T14:09:53+00:00",
      "completed_at": "2026-09-21T14:09:53+00:00",
      "last_exit_code": 0,
      "log_path": "assets/projects/OSS-BLIND-R3/work_items/SUPABASE-50569/.generation/runs/RUN-SUPABASE-50569-BLIND-R3-20260921/logs/case_plan.log"
    },
    {
      "stage_id": "testcases",
      "order": 8,
      "kind": "validation",
      "status": "succeeded",
      "attempts": 1,
      "required_files": [
        "testcases/testcases_main.md",
        "testcases/testpoints.json"
      ],
      "input_fingerprint": "21b9e79317736f9842f4a3bcbc1d161d26d6d954fe6c53e722ee9de18984a05b",
      "started_at": "2026-09-21T14:09:53+00:00",
      "completed_at": "2026-09-21T14:09:53+00:00",
      "last_exit_code": 0,
      "log_path": "assets/projects/OSS-BLIND-R3/work_items/SUPABASE-50569/.generation/runs/RUN-SUPABASE-50569-BLIND-R3-20260921/logs/testcases.log"
    },
    {
      "stage_id": "traceability",
      "order": 9,
      "kind": "validation",
      "status": "succeeded",
      "attempts": 1,
      "required_files": [
        "traceability/coverage_first_traceability.json"
      ],
      "input_fingerprint": "aa6056082c23b472a893bfa4173a30faba9cfe620f49cb3f3f2be31f6b4040f0",
      "started_at": "2026-09-21T14:23:25+00:00",
      "completed_at": "2026-09-21T14:23:25+00:00",
      "last_exit_code": 0,
      "log_path": "assets/projects/OSS-BLIND-R3/work_items/SUPABASE-50569/.generation/runs/RUN-SUPABASE-50569-BLIND-R3-20260921/logs/traceability.log"
    },
    {
      "stage_id": "review",
      "order": 10,
      "kind": "checkpoint",
      "status": "succeeded",
      "attempts": 3,
      "required_files": [
        "reviews/review_record.md",
        "reviews/quality_report.json"
      ],
      "input_fingerprint": "73b2ca1d20a7e9d6b02dd966f2bdb721f9c9578a5b90f1905456c87e2a476855",
      "started_at": "2026-09-22T05:33:06+00:00",
      "completed_at": "2026-09-22T05:33:06+00:00",
      "last_exit_code": 0,
      "log_path": "assets/projects/OSS-BLIND-R3/work_items/SUPABASE-50569/.generation/runs/RUN-SUPABASE-50569-BLIND-R3-20260921/logs/review.log"
    },
    {
      "stage_id": "strict_gate",
      "order": 11,
      "kind": "gate",
      "status": "succeeded",
      "attempts": 1,
      "required_files": [
        "manifest.json"
      ],
      "input_fingerprint": "3494811d9bee0f3f3991a7a53b2f2753d2bfe4f32904fd90537fef2d0697b1f1",
      "started_at": "2026-09-22T05:33:06+00:00",
      "completed_at": "2026-09-22T05:33:07+00:00",
      "last_exit_code": 0,
      "log_path": "assets/projects/OSS-BLIND-R3/work_items/SUPABASE-50569/.generation/runs/RUN-SUPABASE-50569-BLIND-R3-20260921/logs/strict_gate.log"
    }
  ],
  "last_error": null
}
