{
  "schema_version": "1.0.0",
  "run_id": "RUN-CELERY-FEEDBACK-20260922",
  "project_code": "OSS-BLIND-R3",
  "work_item_id": "CELERY-10668",
  "work_item_level": "M",
  "mode": "validate",
  "strict": true,
  "status": "cancelled",
  "stop_at": "strict_gate",
  "current_stage": null,
  "created_at": "2026-09-22T00:36:12+00:00",
  "updated_at": "2026-09-22T00:36:31+00:00",
  "run_dir": "assets/projects/OSS-BLIND-R3/work_items/CELERY-10668/.generation/runs/RUN-CELERY-FEEDBACK-20260922",
  "stages": [
    {
      "stage_id": "requirement_intake",
      "order": 0,
      "kind": "validation",
      "status": "waiting_approval",
      "attempts": 1,
      "required_files": [
        "inputs/requirement_summary.md",
        "inputs/source_manifest.json"
      ],
      "input_fingerprint": "88ccdf68ddf1f306ecbfcb4d1aad2e00b4866b43d2f8dfaefa148ec9eb89daae",
      "started_at": "2026-09-22T00:36:12+00:00",
      "completed_at": "2026-09-22T00:36:12+00:00",
      "last_exit_code": 0,
      "log_path": "assets/projects/OSS-BLIND-R3/work_items/CELERY-10668/.generation/runs/RUN-CELERY-FEEDBACK-20260922/logs/requirement_intake.log"
    },
    {
      "stage_id": "evidence",
      "order": 1,
      "kind": "checkpoint",
      "status": "pending",
      "attempts": 0,
      "required_files": [
        "evidence/evidence_inventory.json"
      ],
      "input_fingerprint": "",
      "started_at": null,
      "completed_at": null,
      "last_exit_code": null,
      "log_path": null
    },
    {
      "stage_id": "reasoning",
      "order": 2,
      "kind": "validation",
      "status": "pending",
      "attempts": 0,
      "required_files": [
        "analysis/reasoning_pack.json"
      ],
      "input_fingerprint": "",
      "started_at": null,
      "completed_at": null,
      "last_exit_code": null,
      "log_path": null
    },
    {
      "stage_id": "structured_prd",
      "order": 3,
      "kind": "validation",
      "status": "pending",
      "attempts": 0,
      "required_files": [
        "structured_prd/structured_prd.json"
      ],
      "input_fingerprint": "",
      "started_at": null,
      "completed_at": null,
      "last_exit_code": null,
      "log_path": null
    },
    {
      "stage_id": "coverage",
      "order": 4,
      "kind": "validation",
      "status": "pending",
      "attempts": 0,
      "required_files": [
        "coverage/coverage_matrix.json"
      ],
      "input_fingerprint": "",
      "started_at": null,
      "completed_at": null,
      "last_exit_code": null,
      "log_path": null
    },
    {
      "stage_id": "testability_gate",
      "order": 5,
      "kind": "validation",
      "status": "pending",
      "attempts": 0,
      "required_files": [
        "acceptance/testability_gate.json"
      ],
      "input_fingerprint": "",
      "started_at": null,
      "completed_at": null,
      "last_exit_code": null,
      "log_path": null
    },
    {
      "stage_id": "acceptance_examples",
      "order": 6,
      "kind": "validation",
      "status": "pending",
      "attempts": 0,
      "required_files": [
        "acceptance/acceptance_examples.json"
      ],
      "input_fingerprint": "",
      "started_at": null,
      "completed_at": null,
      "last_exit_code": null,
      "log_path": null
    },
    {
      "stage_id": "case_plan",
      "order": 7,
      "kind": "validation",
      "status": "pending",
      "attempts": 0,
      "required_files": [
        "testcases/case_plan.json"
      ],
      "input_fingerprint": "",
      "started_at": null,
      "completed_at": null,
      "last_exit_code": null,
      "log_path": null
    },
    {
      "stage_id": "testcases",
      "order": 8,
      "kind": "validation",
      "status": "pending",
      "attempts": 0,
      "required_files": [
        "testcases/testcases_main.md",
        "testcases/testpoints.json"
      ],
      "input_fingerprint": "",
      "started_at": null,
      "completed_at": null,
      "last_exit_code": null,
      "log_path": null
    },
    {
      "stage_id": "traceability",
      "order": 9,
      "kind": "validation",
      "status": "pending",
      "attempts": 0,
      "required_files": [
        "traceability/coverage_first_traceability.json"
      ],
      "input_fingerprint": "",
      "started_at": null,
      "completed_at": null,
      "last_exit_code": null,
      "log_path": null
    },
    {
      "stage_id": "review",
      "order": 10,
      "kind": "validation",
      "status": "pending",
      "attempts": 0,
      "required_files": [
        "reviews/review_record.md",
        "reviews/quality_report.json",
        "design/design_feedback.json"
      ],
      "input_fingerprint": "",
      "started_at": null,
      "completed_at": null,
      "last_exit_code": null,
      "log_path": null
    },
    {
      "stage_id": "strict_gate",
      "order": 11,
      "kind": "gate",
      "status": "pending",
      "attempts": 0,
      "required_files": [
        "manifest.json"
      ],
      "input_fingerprint": "",
      "started_at": null,
      "completed_at": null,
      "last_exit_code": null,
      "log_path": null
    }
  ],
  "last_error": null
}
