{
  "schema_version": "1.0.0",
  "run_id": "RUN-CHATWOOT-15768-BLIND-20260921",
  "project_code": "OSS-BLIND",
  "work_item_id": "CHATWOOT-15768",
  "work_item_level": "M",
  "mode": "validate",
  "strict": true,
  "status": "completed",
  "stop_at": "strict_gate",
  "current_stage": null,
  "created_at": "2026-09-21T05:59:27+00:00",
  "updated_at": "2026-09-21T10:40:45+00:00",
  "run_dir": "assets/projects/OSS-BLIND/work_items/CHATWOOT-15768/.generation/runs/RUN-CHATWOOT-15768-BLIND-20260921",
  "stages": [
    {
      "stage_id": "requirement_intake",
      "order": 0,
      "kind": "validation",
      "status": "succeeded",
      "attempts": 1,
      "required_files": [
        "inputs/requirement_summary.md",
        "inputs/source_manifest.json"
      ],
      "input_fingerprint": "7da09293bbfd7784b158e45fff35dec41c24843ad391f7e3f1050d4339bc7795",
      "started_at": "2026-09-21T05:59:27+00:00",
      "completed_at": "2026-09-21T05:59:27+00:00",
      "last_exit_code": 0,
      "log_path": "assets/projects/OSS-BLIND/work_items/CHATWOOT-15768/.generation/runs/RUN-CHATWOOT-15768-BLIND-20260921/logs/requirement_intake.log"
    },
    {
      "stage_id": "evidence",
      "order": 1,
      "kind": "checkpoint",
      "status": "succeeded",
      "attempts": 2,
      "required_files": [
        "evidence/evidence_inventory.json"
      ],
      "input_fingerprint": "7fff21265c9b5748ea2a09639de9392b685882d49a8b1297ff2f34108d348566",
      "started_at": "2026-09-21T07:09:30+00:00",
      "completed_at": "2026-09-21T07:09:30+00:00",
      "last_exit_code": 0,
      "log_path": "assets/projects/OSS-BLIND/work_items/CHATWOOT-15768/.generation/runs/RUN-CHATWOOT-15768-BLIND-20260921/logs/evidence.log"
    },
    {
      "stage_id": "reasoning",
      "order": 2,
      "kind": "validation",
      "status": "succeeded",
      "attempts": 2,
      "required_files": [
        "analysis/reasoning_pack.json"
      ],
      "input_fingerprint": "768114ea625abcda0b77e07057ff8e2a8aa7ef321330ff5cba1ca42892d3505d",
      "started_at": "2026-09-21T07:09:30+00:00",
      "completed_at": "2026-09-21T07:09:30+00:00",
      "last_exit_code": 0,
      "log_path": "assets/projects/OSS-BLIND/work_items/CHATWOOT-15768/.generation/runs/RUN-CHATWOOT-15768-BLIND-20260921/logs/reasoning.log"
    },
    {
      "stage_id": "structured_prd",
      "order": 3,
      "kind": "validation",
      "status": "succeeded",
      "attempts": 3,
      "required_files": [
        "structured_prd/structured_prd.json"
      ],
      "input_fingerprint": "cf6f41c5cf6c8d26a31bb6a509d8e264dabeaa22daa62fdbe62067684f8cbe30",
      "started_at": "2026-09-21T10:27:18+00:00",
      "completed_at": "2026-09-21T10:27:19+00:00",
      "last_exit_code": 0,
      "log_path": "assets/projects/OSS-BLIND/work_items/CHATWOOT-15768/.generation/runs/RUN-CHATWOOT-15768-BLIND-20260921/logs/structured_prd.log"
    },
    {
      "stage_id": "coverage",
      "order": 4,
      "kind": "validation",
      "status": "succeeded",
      "attempts": 4,
      "required_files": [
        "coverage/coverage_matrix.json"
      ],
      "input_fingerprint": "e922591e86019dd6b97193a12a9a08f6086b2237c96f66af895e7bf73b1950cb",
      "started_at": "2026-09-21T10:27:19+00:00",
      "completed_at": "2026-09-21T10:27:19+00:00",
      "last_exit_code": 0,
      "log_path": "assets/projects/OSS-BLIND/work_items/CHATWOOT-15768/.generation/runs/RUN-CHATWOOT-15768-BLIND-20260921/logs/coverage.log"
    },
    {
      "stage_id": "testability_gate",
      "order": 5,
      "kind": "validation",
      "status": "succeeded",
      "attempts": 3,
      "required_files": [
        "acceptance/testability_gate.json"
      ],
      "input_fingerprint": "b73195e56d1c44caeaf0aaead73f6d043ffd643f936bbaff3c3536cfdd36b78d",
      "started_at": "2026-09-21T10:27:19+00:00",
      "completed_at": "2026-09-21T10:27:19+00:00",
      "last_exit_code": 0,
      "log_path": "assets/projects/OSS-BLIND/work_items/CHATWOOT-15768/.generation/runs/RUN-CHATWOOT-15768-BLIND-20260921/logs/testability_gate.log"
    },
    {
      "stage_id": "acceptance_examples",
      "order": 6,
      "kind": "validation",
      "status": "succeeded",
      "attempts": 2,
      "required_files": [
        "acceptance/acceptance_examples.json"
      ],
      "input_fingerprint": "873381c5acda3083bc21cd75d548fd8d3a63a9400776a8bedbd25b0572805d42",
      "started_at": "2026-09-21T10:27:19+00:00",
      "completed_at": "2026-09-21T10:27:19+00:00",
      "last_exit_code": 0,
      "log_path": "assets/projects/OSS-BLIND/work_items/CHATWOOT-15768/.generation/runs/RUN-CHATWOOT-15768-BLIND-20260921/logs/acceptance_examples.log"
    },
    {
      "stage_id": "case_plan",
      "order": 7,
      "kind": "validation",
      "status": "succeeded",
      "attempts": 3,
      "required_files": [
        "testcases/case_plan.json"
      ],
      "input_fingerprint": "57dba4670f708f2317a196a796013ea31f4b57bf0c93bb63783ec2f385a0a84d",
      "started_at": "2026-09-21T10:27:19+00:00",
      "completed_at": "2026-09-21T10:27:19+00:00",
      "last_exit_code": 0,
      "log_path": "assets/projects/OSS-BLIND/work_items/CHATWOOT-15768/.generation/runs/RUN-CHATWOOT-15768-BLIND-20260921/logs/case_plan.log"
    },
    {
      "stage_id": "testcases",
      "order": 8,
      "kind": "validation",
      "status": "succeeded",
      "attempts": 2,
      "required_files": [
        "testcases/testcases_main.md",
        "testcases/testpoints.json"
      ],
      "input_fingerprint": "671c24d1f300db32cebdd86475d1fa7981b501a9e7ee8257ef89230674112cff",
      "started_at": "2026-09-21T10:27:19+00:00",
      "completed_at": "2026-09-21T10:27:19+00:00",
      "last_exit_code": 0,
      "log_path": "assets/projects/OSS-BLIND/work_items/CHATWOOT-15768/.generation/runs/RUN-CHATWOOT-15768-BLIND-20260921/logs/testcases.log"
    },
    {
      "stage_id": "traceability",
      "order": 9,
      "kind": "validation",
      "status": "succeeded",
      "attempts": 2,
      "required_files": [
        "traceability/coverage_first_traceability.json"
      ],
      "input_fingerprint": "ffb2fc1b260da6cc2c10133f339682878a66d9d80924825367d8471fcd9aa0b7",
      "started_at": "2026-09-21T10:27:19+00:00",
      "completed_at": "2026-09-21T10:27:19+00:00",
      "last_exit_code": 0,
      "log_path": "assets/projects/OSS-BLIND/work_items/CHATWOOT-15768/.generation/runs/RUN-CHATWOOT-15768-BLIND-20260921/logs/traceability.log"
    },
    {
      "stage_id": "review",
      "order": 10,
      "kind": "checkpoint",
      "status": "succeeded",
      "attempts": 2,
      "required_files": [
        "reviews/review_record.md",
        "reviews/quality_report.json"
      ],
      "input_fingerprint": "6715cb6501424bc463e3bb82fc5c7fb74dd81d5b36ae09cbe49eda57bcde1bc3",
      "started_at": "2026-09-21T10:27:19+00:00",
      "completed_at": "2026-09-21T10:27:19+00:00",
      "last_exit_code": 0,
      "log_path": "assets/projects/OSS-BLIND/work_items/CHATWOOT-15768/.generation/runs/RUN-CHATWOOT-15768-BLIND-20260921/logs/review.log"
    },
    {
      "stage_id": "strict_gate",
      "order": 11,
      "kind": "gate",
      "status": "succeeded",
      "attempts": 2,
      "required_files": [
        "manifest.json"
      ],
      "input_fingerprint": "3f389047ebf621e50955e0155d6bdcdfe0e5912cc15a4096d66fdb5de336d282",
      "started_at": "2026-09-21T10:40:44+00:00",
      "completed_at": "2026-09-21T10:40:45+00:00",
      "last_exit_code": 0,
      "log_path": "assets/projects/OSS-BLIND/work_items/CHATWOOT-15768/.generation/runs/RUN-CHATWOOT-15768-BLIND-20260921/logs/strict_gate.log"
    }
  ],
  "last_error": null
}
