{
  "schema_version": "1.0.0",
  "run_id": "RUN-PT083-FULL-20260826",
  "project_code": "WX-YGJ",
  "work_item_id": "PT083",
  "work_item_level": "M",
  "mode": "validate",
  "strict": true,
  "status": "paused",
  "stop_at": "traceability",
  "current_stage": null,
  "created_at": "2026-08-26T15:11:57+00:00",
  "updated_at": "2026-08-26T23:49:56+00:00",
  "run_dir": "assets/projects/WX-YGJ/work_items/PT083/.generation/runs/RUN-PT083-FULL-20260826",
  "stages": [
    {
      "stage_id": "requirement_intake",
      "order": 0,
      "kind": "validation",
      "status": "succeeded",
      "attempts": 1,
      "required_files": [
        "inputs/requirement_summary.md",
        "inputs/source_manifest.json"
      ],
      "input_fingerprint": "8441625cb4a456e17f8e334dee799dd533544f8b4329d4736ef0fe067edfecc4",
      "started_at": "2026-08-26T15:11:57+00:00",
      "completed_at": "2026-08-26T15:11:57+00:00",
      "last_exit_code": 0,
      "log_path": "assets/projects/WX-YGJ/work_items/PT083/.generation/runs/RUN-PT083-FULL-20260826/logs/requirement_intake.log"
    },
    {
      "stage_id": "evidence",
      "order": 1,
      "kind": "checkpoint",
      "status": "succeeded",
      "attempts": 1,
      "required_files": [
        "evidence/evidence_inventory.json"
      ],
      "input_fingerprint": "63e030b552a2a57bb33851060611a9a9fcd1f4ad2c50c419289e047486841851",
      "started_at": "2026-08-26T15:12:30+00:00",
      "completed_at": "2026-08-26T15:12:30+00:00",
      "last_exit_code": 0,
      "log_path": "assets/projects/WX-YGJ/work_items/PT083/.generation/runs/RUN-PT083-FULL-20260826/logs/evidence.log"
    },
    {
      "stage_id": "reasoning",
      "order": 2,
      "kind": "checkpoint",
      "status": "succeeded",
      "attempts": 1,
      "required_files": [
        "analysis/reasoning_pack.json"
      ],
      "input_fingerprint": "84165a8e951abd31f0fa451fc075b564723a028afb580d17474b4e0f6134f933",
      "started_at": "2026-08-26T23:46:08+00:00",
      "completed_at": "2026-08-26T23:46:08+00:00",
      "last_exit_code": 0,
      "log_path": "assets/projects/WX-YGJ/work_items/PT083/.generation/runs/RUN-PT083-FULL-20260826/logs/reasoning.log"
    },
    {
      "stage_id": "structured_prd",
      "order": 3,
      "kind": "validation",
      "status": "succeeded",
      "attempts": 1,
      "required_files": [
        "structured_prd/structured_prd.json"
      ],
      "input_fingerprint": "7dcc954194f1a4eee2f4a522bf76e4d26a6d1632e8c183c9a9efdf289de5fd8f",
      "started_at": "2026-08-26T23:48:02+00:00",
      "completed_at": "2026-08-26T23:48:02+00:00",
      "last_exit_code": 0,
      "log_path": "assets/projects/WX-YGJ/work_items/PT083/.generation/runs/RUN-PT083-FULL-20260826/logs/structured_prd.log"
    },
    {
      "stage_id": "coverage",
      "order": 4,
      "kind": "validation",
      "status": "succeeded",
      "attempts": 1,
      "required_files": [
        "coverage/coverage_matrix.json"
      ],
      "input_fingerprint": "e6c1c44d1aa45a48dfa6f67dd1fdf263f2db52167965e9ad18f1ef6f40f5fc19",
      "started_at": "2026-08-26T23:48:02+00:00",
      "completed_at": "2026-08-26T23:48:02+00:00",
      "last_exit_code": 0,
      "log_path": "assets/projects/WX-YGJ/work_items/PT083/.generation/runs/RUN-PT083-FULL-20260826/logs/coverage.log"
    },
    {
      "stage_id": "testability_gate",
      "order": 5,
      "kind": "validation",
      "status": "succeeded",
      "attempts": 1,
      "required_files": [
        "acceptance/testability_gate.json"
      ],
      "input_fingerprint": "dd4cd5b8679b33afe5dce2269665a1205547657dcf463e0877a1437ea22bc59f",
      "started_at": "2026-08-26T23:48:02+00:00",
      "completed_at": "2026-08-26T23:48:02+00:00",
      "last_exit_code": 0,
      "log_path": "assets/projects/WX-YGJ/work_items/PT083/.generation/runs/RUN-PT083-FULL-20260826/logs/testability_gate.log"
    },
    {
      "stage_id": "acceptance_examples",
      "order": 6,
      "kind": "validation",
      "status": "succeeded",
      "attempts": 1,
      "required_files": [
        "acceptance/acceptance_examples.json"
      ],
      "input_fingerprint": "6eec37d6865ad35b18622a4bf160700da8479ed132cd84c4a853ca44ad02751f",
      "started_at": "2026-08-26T23:48:02+00:00",
      "completed_at": "2026-08-26T23:48:02+00:00",
      "last_exit_code": 0,
      "log_path": "assets/projects/WX-YGJ/work_items/PT083/.generation/runs/RUN-PT083-FULL-20260826/logs/acceptance_examples.log"
    },
    {
      "stage_id": "case_plan",
      "order": 7,
      "kind": "validation",
      "status": "succeeded",
      "attempts": 1,
      "required_files": [
        "testcases/case_plan.json"
      ],
      "input_fingerprint": "4183ca7be89d7758a28e70602ed9403b60c533bf8a620616675a3f6969901d2b",
      "started_at": "2026-08-26T23:48:02+00:00",
      "completed_at": "2026-08-26T23:48:02+00:00",
      "last_exit_code": 0,
      "log_path": "assets/projects/WX-YGJ/work_items/PT083/.generation/runs/RUN-PT083-FULL-20260826/logs/case_plan.log"
    },
    {
      "stage_id": "testcases",
      "order": 8,
      "kind": "validation",
      "status": "succeeded",
      "attempts": 1,
      "required_files": [
        "testcases/testcases_main.md",
        "testcases/testpoints.json"
      ],
      "input_fingerprint": "1c510f9be02c856a3c95adeff78584e47ad604fe6db7619dc87c300e10d7def5",
      "started_at": "2026-08-26T23:49:30+00:00",
      "completed_at": "2026-08-26T23:49:30+00:00",
      "last_exit_code": 0,
      "log_path": "assets/projects/WX-YGJ/work_items/PT083/.generation/runs/RUN-PT083-FULL-20260826/logs/testcases.log"
    },
    {
      "stage_id": "traceability",
      "order": 9,
      "kind": "validation",
      "status": "succeeded",
      "attempts": 1,
      "required_files": [
        "traceability/coverage_first_traceability.json"
      ],
      "input_fingerprint": "6e73e3c8477395cd600a085db614bed3ee42b40d017e11d19f4c3393d8ca984a",
      "started_at": "2026-08-26T23:49:56+00:00",
      "completed_at": "2026-08-26T23:49:56+00:00",
      "last_exit_code": 0,
      "log_path": "assets/projects/WX-YGJ/work_items/PT083/.generation/runs/RUN-PT083-FULL-20260826/logs/traceability.log"
    },
    {
      "stage_id": "review",
      "order": 10,
      "kind": "checkpoint",
      "status": "pending",
      "attempts": 0,
      "required_files": [
        "reviews/review_record.md",
        "reviews/quality_report.json"
      ],
      "input_fingerprint": "",
      "started_at": null,
      "completed_at": null,
      "last_exit_code": null,
      "log_path": null
    },
    {
      "stage_id": "strict_gate",
      "order": 11,
      "kind": "gate",
      "status": "pending",
      "attempts": 0,
      "required_files": [
        "manifest.json"
      ],
      "input_fingerprint": "",
      "started_at": null,
      "completed_at": null,
      "last_exit_code": null,
      "log_path": null
    }
  ],
  "last_error": null
}
